id,country,iso,admin_level_name,pcode,region,log_type,category,measure,targeted_pop_group,comments,non_compliance,date_implemented,source,source_type,link,entry_date,alternative_source
38,Bangladesh,BGD,,,Asia,Introduction / extension of measures,Public health measures,Isolation and quarantine policies,Yes,"14 days self-quarantine, foreign nationals arriving from China, Italy, Iran or South Korea",Not applicable,2020-03-08T00:00:00,UK Government Travel Advice,Government,https://www.gov.uk/foreign-travel-advice/bangladesh/health,3/20/20,https://bd.usembassy.gov/health-alert-u-s-embassy-dhaka-bangladesh-2/
211,Bangladesh,BGD,,,Asia,Introduction / extension of measures,Movement restrictions,International flights suspension,Yes,"From March 16 to 31, foreign nationals on flights originating from Europe, except for the United Kingdom, will not be allowed to enter Bangladesh.",Not applicable,2020-03-16T00:00:00,UK Government Travel Advice,Government,https://www.gov.uk/foreign-travel-advice/bangladesh/health,3/15/20,https://bd.usembassy.gov/health-alert-u-s-embassy-dhaka-bangladesh-3/
214,Bangladesh,BGD,,,Asia,Introduction / extension of measures,Movement restrictions,Visa restrictions,No,Issuance of on-arrival visas for Bangladesh will remain suspended for two weeks between March 15 to 29 for incoming passengers of all countries. Foreign nationals with valid visas staying in Bangladesh now will have the option of extending their existing visas for up to three months.,Not applicable,2020-03-16T00:00:00,UK Government Travel Advice,Government,https://www.gov.uk/foreign-travel-advice/bangladesh/health,3/15/20,https://bd.usembassy.gov/health-alert-u-s-embassy-dhaka-bangladesh-3/
6958,Bangladesh,BGD,,,Asia,Introduction / extension of measures,Movement restrictions,Curfews,No,extends existing COVID-19 restrictions until April 25 and imposes curfew from April 10 ,,2020-04-10T00:00:00,Garda,Other organisations,https://www.garda.com/crisis24/news-alerts/331331/bangladesh-government-extends-existing-covid-19-restrictions-until-april-25-and-imposes-curfew-from-april-10-update-7,4/21/20,
7257,Bangladesh,BGD,,,Asia,Introduction / extension of measures,Movement restrictions,Visa restrictions,Yes,"Travelers who lived in or visited the EU region and Iran since March 1, 2020 will not be allowed to enter Bangladesh until April 15, 2020.  However, those travelers who have not been to the EU region or Iran on or before February 29, 2020 will be permitted to enter Bangladesh with valid visas.",Refusal to enter the country,2020-03-01T00:00:00,US Embassy,Government,https://bd.usembassy.gov/covid-19-information/,4/24/20,
7258,Bangladesh,BGD,,,Asia,Introduction / extension of measures,Movement restrictions,Additional health/documents requirements upon arrival,Yes,"Foreign nationals with valid visas will be required to produce a medical certificate (with English translation) to be obtained within 72 hours of travel, indicating that they do not have any symptoms of COVID-19.  This medical certificate needs to be submitted on arrival at the Bangladesh point of entry (airport/seaport/land port).",Refusal to enter the country,2020-03-01T00:00:00,US Embassy,Government,https://bd.usembassy.gov/covid-19-information/,4/24/20,
7259,Bangladesh,BGD,,,Asia,Introduction / extension of measures,Public health measures,Health screenings in airports and border crossings,No,screening measures ,Not applicable,2020-03-08T00:00:00,US Embassy,Government,https://bd.usembassy.gov/health-alert-u-s-embassy-dhaka-bangladesh-2/,4/24/20,
7260,Bangladesh,BGD,,,Asia,Introduction / extension of measures,Public health measures,Isolation and quarantine policies,Yes,Passengers arriving in Bangladesh from other coronavirus-affected countries will be placed under self-quarantine for two weeks after arrival.  This will continue until further notice.,Not available,2020-03-16T00:00:00,US Embassy,Government,https://bd.usembassy.gov/health-alert-u-s-embassy-dhaka-bangladesh-3/,4/24/20,
7261,Bangladesh,BGD,,,Asia,Introduction / extension of measures,Movement restrictions,Additional health/documents requirements upon arrival,No,medical certificates that may be required in order to travel,Not applicable,2020-03-20T00:00:00,US Embassy,Government,https://bd.usembassy.gov/health-alert-u-s-embassy-dhaka-bangladesh-4/,4/24/20,
7262,Bangladesh,BGD,,,Asia,Introduction / extension of measures,Movement restrictions,International flights suspension,No,prohibit most – but not all — incoming flights from landing at all international airports in Bangladesh.  The Hazrat Shahjalal International Airport remains open with limited flights.,Not applicable,2020-03-21T00:00:00,US Embassy,Government,https://bd.usembassy.gov/health-alert-u-s-embassy-dhaka-bangladesh-march-21-2020/,4/24/20,https://bd.usembassy.gov/health-alert-032320/
7263,Bangladesh,BGD,,,Asia,Introduction / extension of measures,Lockdown,Partial lockdown,No,"general holiday period from March 29 to April 11.  Bangladeshi government offices and private sector organizations will largely remain closed until April 9 and the government has advised everyone to stay home during this period.  Hospitals, pharmacies, and food stores remain open.  Public transportation and banking services remain limited.  ",Not applicable,2020-03-29T00:00:00,US Embassy,Government,https://bd.usembassy.gov/health-travel-alert-u-s-embassy-dhaka-bangladesh/,4/24/20,
7264,Bangladesh,BGD,,,Asia,Introduction / extension of measures,Governance and socio-economic measures,Military deployment,No,army has been deployed to enforce social distancing measures.,Not applicable,2020-03-29T00:00:00,US Embassy,Government,https://bd.usembassy.gov/health-travel-alert-u-s-embassy-dhaka-bangladesh/,4/24/20,
7265,Bangladesh,BGD,,,Asia,Introduction / extension of measures,Movement restrictions,International flights suspension,No,"Until April 7, all scheduled international commercial passenger flights from Bahrain, Bhutan, Hong Kong, India, Kuwait, Malaysia, Oman, Qatar, Saudi Arabia, Sri Lanka, Singapore, Thailand, Turkey, and United Arab Emirates (UAE) shall not be allowed to land at any international airport in Bangladesh.",Refusal to enter the country,2020-03-29T00:00:00,US Embassy,Government,https://bd.usembassy.gov/health-travel-alert-u-s-embassy-dhaka-bangladesh/,4/24/20,
7266,Bangladesh,BGD,,,Asia,Introduction / extension of measures,Governance and socio-economic measures,Emergency administrative structures activated or established,No,National Guidelines on Clinical Management of Coronavirus Disease 2019 (Covid-19),Not applicable,2020-03-30T00:00:00,Government of Bangladesh,Government,https://corona.gov.bd/documents/COVID_Guideline_V4.0..30.3.2020.pdf,4/24/20,
7267,Bangladesh,BGD,,,Asia,Introduction / extension of measures,Lockdown,Partial lockdown,No,Holiday period extended to April 25,Not applicable,2020-04-12T00:00:00,US Embassy,Government,https://bd.usembassy.gov/covid-19-information/,4/24/20,
7268,Bangladesh,BGD,,,Asia,Introduction / extension of measures,Governance and socio-economic measures,Emergency administrative structures activated or established,No,Activated Health and Social Protection Programme to Fight COVID-19,Not applicable,2020-04-13T00:00:00,Ministry of Foreign Affair,Government,https://mofa.gov.bd/site/press_release/0d0e1500-e44d-4edd-9d0c-6831c8b87aeb,4/24/20,
8143,Bangladesh,BGD,,,Asia,Introduction / extension of measures,Lockdown,Partial lockdown,No,extending the general holiday period to May 5,Not applicable,2020-04-29T00:00:00,US Embassy,Government,https://bd.usembassy.gov/travel-health-alert-u-s-embassy-dhaka-bangladesh/,4/29/20,
8144,Bangladesh,BGD,,,Asia,Introduction / extension of measures,Movement restrictions,Curfews,No,"A daily curfew is in effect from 6 p.m. to 6 a.m.  Hospitals, pharmacies, and food stores remain open. ",Not available,2020-04-29T00:00:00,US Embassy,Government,https://bd.usembassy.gov/travel-health-alert-u-s-embassy-dhaka-bangladesh/,4/29/20,
11023,Bangladesh,BGD,,,Asia,Introduction / extension of measures,Lockdown,Partial lockdown,No,"The Government of Bangladesh’s general holiday period has been extended to May 30.  Bangladeshi government offices and private sector organizations will largely be closed from March 26 to May 30 and the government has advised everyone to stay home during this period.  Hospitals, pharmacies, and kitchen markets will remain open.  Public transportation and banking services will be limited.",Not applicable,2020-05-12T00:00:00,US Embassy,Government,https://bd.usembassy.gov/covid-19-information/,5/18/20,
11024,Bangladesh,BGD,,,Asia,Introduction / extension of measures,Movement restrictions,International flights suspension,No,"until May 30 all scheduled international commercial passenger flights from Bahrain, Bhutan, Hong Kong, India, Kuwait, Malaysia, Maldives, Oman, Qatar, Saudi Arabia, Sri Lanka, Singapore, Thailand, Turkey, UAE and UK shall not be allowed to land at any international airport in Bangladesh.  ",Refusal to enter the country,2020-05-12T00:00:00,US Embassy,Government,https://bd.usembassy.gov/covid-19-information/,5/18/20,
11025,Bangladesh,BGD,,,Asia,Introduction / extension of measures,Movement restrictions,Domestic travel restrictions,No,All domestic commercial passenger flights are also suspended until May 30.,Not applicable,2020-05-12T00:00:00,US Embassy,Government,https://bd.usembassy.gov/covid-19-information/,5/18/20,
11026,Bangladesh,BGD,,,Asia,Introduction / extension of measures,Movement restrictions,Additional health/documents requirements upon arrival,Yes,"Foreign nationals with valid visas will be required to produce a medical certificate (with English translation) to be obtained within 72 hours of travel, indicating that they are COVID-19 negative.  This medical certificate needs to be submitted on arrival at the Bangladesh point of entry (airport/seaport/land port).",Refusal to enter the country,2020-05-12T00:00:00,US Embassy,Government,https://bd.usembassy.gov/covid-19-information/,5/18/20,
11027,Bangladesh,BGD,,,Asia,Introduction / extension of measures,Public health measures,Isolation and quarantine policies,No,"Updated isolation/quarantine measures based on ""no visa required"" stamp",Not applicable,2020-05-12T00:00:00,US Embassy,Government,https://bd.usembassy.gov/covid-19-information/,5/18/20,
11028,Bangladesh,BGD,,,Asia,Introduction / extension of measures,Governance and socio-economic measures,Emergency administrative structures activated or established,No,How to Run a COVID-19 Hospital in Bangladesh,Not applicable,2020-04-07T00:00:00,Bangladesh COVID-19 Press Releases,Government,https://corona.gov.bd/storage/press-releases/April2020/g0MbdFSz5rwPzA8qhYFN.pdf,5/18/20,
11029,Bangladesh,BGD,,,Asia,Introduction / extension of measures,Governance and socio-economic measures,Emergency administrative structures activated or established,No,National Guideline for Health Care Provider On Infection Prevention and Control of COVID-19 pandemic in Healthcare Setting,Not applicable,2020-03-19T00:00:00,Bangladesh COVID-19 Press Releases,Government,https://corona.gov.bd/storage/press-releases/April2020/yGb3jOogw35AGGGU15uo.pdf,5/18/20,
11030,Bangladesh,BGD,,,Asia,Introduction / extension of measures,Governance and socio-economic measures,Economic measures,No,Targeting Covid-19 Relief Payments in Bangladesh,Not applicable,2020-05-08T00:00:00,Bangladesh COVID-19 Press Releases,Government,https://corona.gov.bd/storage/press-releases/May2020/kjgxIpeVzLNB8dzGnO1y.pdf,5/18/20,
13937,Bangladesh,BGD,,,Asia,Introduction / extension of measures,Movement restrictions,Domestic travel restrictions,No,Inter-district  travel  will  be  strictly  controlled. District  administration  will  enforce  these controls  with  the  assistance  of  law  and  order  forces.,Not applicable,2020-05-31T00:00:00,ACAPS internal cxb comms,Other organisations,,6/18/20,
13938,Bangladesh,BGD,,,Asia,Introduction / extension of measures,Movement restrictions,Checkpoints within the country,No,Checkpoints  will  be present  at  the  entry  and  exit  of  each  district.  District  administration  will  enforce  these controls  with  the  assistance  of  law  and  order  forces.,Not applicable,2020-05-31T00:00:00,ACAPS internal cxb comms,Other organisations,,6/18/20,
13939,Bangladesh,BGD,,,Asia,Introduction / extension of measures,Movement restrictions,Curfews,No,"People are forbidden to come out of their homes between 20:00-6:00 unless very necessary (necessary purchase and sales, commuting to work, purchase of medication, health services, burial of the dead etc.).  All shops, wet markets and shopping malls must be closed by 16:00 (4pm). ",Not applicable,2020-05-31T00:00:00,ACAPS internal cxb comms,Other organisations,,6/18/20,https://bd.usembassy.gov/covid-19-information/
13940,Bangladesh,BGD,,,Asia,Introduction / extension of measures,Public health measures,Requirement to wear protective gear in public,No,Masks should be worn in all circumstances when outdoors and all health regulations must be obeyed. ,Not applicable,2020-05-31T00:00:00,ACAPS internal cxb comms,Other organisations,,6/18/20,
13941,Bangladesh,BGD,,,Asia,Introduction / extension of measures,Social distancing,Schools closure ,No,no educational institution will remain open. But online / distance learning will continue;   ,Not applicable,2020-05-31T00:00:00,ACAPS internal cxb comms,Other organisations,,6/18/20,
13942,Bangladesh,BGD,,,Asia,Phase-out measure,Movement restrictions,Domestic travel restrictions,No,"No one will be allowed to leave station during this time. Public transports, water transports and railways can limitedly operate with limited numbers of passengers maintaining all heath related instructions.",Not applicable,2020-05-31T00:00:00,ACAPS internal cxb comms,Other organisations,,6/18/20,
13943,Bangladesh,BGD,,,Asia,Introduction / extension of measures,Social distancing,Limit public gatherings,No,"No public gatherings, meetings and events to be allowed during this time. Prayers in mosques and other religious gatherings will continue maintaining strict health advisory",Not applicable,2020-05-31T00:00:00,ACAPS internal cxb comms,Other organisations,,6/18/20,
13944,Bangladesh,BGD,,,Asia,Phase-out measure,Social distancing,Closure of businesses and public services,No,"Between May 31 to June 15, offices and workplaces began to reopen",Not applicable,2020-05-31T00:00:00,US Embassy,Government,https://bd.usembassy.gov/covid-19-information/,6/18/20,
13945,Bangladesh,BGD,,,Asia,Phase-out measure,Movement restrictions,Domestic travel restrictions,No,domestic commercial passenger flights will resume in a limited scal,Not applicable,2020-06-01T00:00:00,US Embassy,Government,https://bd.usembassy.gov/covid-19-information/,6/18/20,
15035,Bangladesh,BGD,,,Asia,Phase-out measure,Movement restrictions,International flights suspension,No,"The Government of Bangladesh has authorized the resumption of limited international commercial flights. Biman Bangladesh Airlines, Emirates, and Qatar Airways have resumed flights, and Turkish Airlines is scheduled to resume flights in July.",Not applicable,2020-06-25T00:00:00,US Embassy,Government,https://bd.usembassy.gov/travel-alert-062520/,7/7/20,
15036,Bangladesh,BGD,,,Asia,Introduction / extension of measures,Movement restrictions,Curfews,No,"An update to the curfews set in place on May 31, from July 1- August 3, no one will be allowed outdoors from 10 p.m. to 5 a.m. except to receive medical services, to go to work, or to buy or sell medicine. Stores can remain open until 7 p.m.",Not available,2020-07-01T00:00:00,US Embassy,Government,https://bd.usembassy.gov/covid-19-information/,7/7/20,
15037,Bangladesh,BGD,,,Asia,Introduction / extension of measures,Public health measures,Isolation and quarantine policies,No,"the Civil Aviation Authority of Bangladesh announced until further notice all international commercial passenger flights from Bahrain, Bhutan, Hong Kong, India, Kuwait, Malaysia, Maldives, Nepal, Oman, Saudi Arabia, Sri Lanka, Singapore, Thailand, and Turkey shall not be allowed to land at any airport in Bangladesh.",Refusal to enter the country,2020-06-30T00:00:00,US Embassy,Government,https://bd.usembassy.gov/covid-19-information/,7/7/20,
52,Brazil,BRA,,,Americas,Introduction / extension of measures,Public health measures,Health screenings in airports and border crossings,Yes,People from risky countries,Not available,2020-03-07T00:00:00,Ministry of Foreign Affairs - France,Government,https://www.diplomatie.gouv.fr/fr/conseils-aux-voyageurs/conseils-par-pays-destination/bresil/,3/14/20,
57,Brazil,BRA,,,Americas,Introduction / extension of measures,Public health measures,Isolation and quarantine policies,Yes,7 days quarantine for international travellers - 14 for people with syntoms,Not applicable,2020-03-13T00:00:00,Globo,Media,https://g1.globo.com/bemestar/coronavirus/noticia/2020/03/13/ministerio-da-saude-divulga-orientacoes-para-estados-sobre-coronavirus.ghtml,3/14/20,
772,Brazil,BRA,,,Americas,Introduction / extension of measures,Social distancing,Changes in prison-related policies,Yes,suspension of day-release programmes,,2020-03-16T00:00:00,NYT,Media,https://www.nytimes.com/reuters/2020/03/16/world/americas/16reuters-health-coronavirus-brazil-jails.html,3/17/20,
1107,Brazil,BRA,,,Americas,Introduction / extension of measures,Governance and socio-economic measures,Emergency administrative structures activated or established,No,"Declares ""State of community transmission""",,2020-03-20T00:00:00,Official Diary of the Union ,Government,http://pesquisa.in.gov.br/imprensa/jsp/visualiza/index.jsp?data=20/03/2020&jornal=613&pagina=1,3/21/20,http://www.in.gov.br/en/web/dou/-/portaria-n-454-de-20-de-marco-de-2020-249091587
1123,Brazil,BRA,,,Americas,Introduction / extension of measures,Public health measures,Isolation and quarantine policies,No,Govt. implemented voluntary 7day quarantine ,,2020-03-20T00:00:00,US Embassy of Brazil ,Government,https://br.usembassy.gov/covid-19-information/,3/21/20,
1124,Brazil,BRA,,,Americas,Introduction / extension of measures,Public health measures,Awareness campaigns,No,Ministry of Health holds regular press conferences. Traditional and social media are covering the global epidemic and Brazil-specific issues. ,,2020-03-18T00:00:00,US Embassy of Brazil ,Government,https://br.usembassy.gov/covid-19-information/,3/21/20,
1125,Brazil,BRA,,,Americas,Introduction / extension of measures,Movement restrictions,Border closure ,Yes,"15 day land border suspension- Argentina, Paraguay, Bolivia, Peru, Colombia, Suriname and French Guiana *exception: citizens, permanent residents, diplomats/intl agency officials and trucks of goods",,2020-03-19T00:00:00,Aljazeera,Media,https://www.aljazeera.com/news/2020/03/coronavirus-travel-restrictions-border-shutdowns-country-200318091505922.html,3/21/20,https://www.sentinelandenterprise.com/2020/03/19/brazils-bolsonaro-strives-to-regain-leadership-amid-virus/
2216,Brazil,BRA,,,Americas,Introduction / extension of measures,Movement restrictions,Visa restrictions,Yes,"travelers from folowing countries are not premitted entry: China, EU, UK, Ireland, Switzerland, Iceland, Norway, Australia, Iran, Japan, Malaysia and Korea (Rep.), Venezuela, Argentina, Bolivia, Colombia, Guyana, Paraguay, Peru, Suriname. *Exceptions: citizens and residents, family members of Brazilians, diplomats and persons traveling for Brazilian government and crew. All-cargo operations are permitted. Transit passengers are allowed, whether coming or not from the restricted countries, as long as the passenger does not leave the international airport area. Exceptionally, foreigners who are in one of the land border countries and need to cross to Brazil to board a repatriation flight may enter Brazil with authorization from Federal Police, provided that the traveler goes directly to the airport, ticket in hand, and authorized by the respective embassy or consulate of both countries.",Not applicable,2020-03-23T00:00:00,International SOS,Other organisations,https://pandemic.internationalsos.com/2019-ncov/ncov-travel-restrictions-flight-operations-and-screening#MYS,3/25/20,
2217,Brazil,BRA,,,Americas,Introduction / extension of measures,Movement restrictions,Border closure ,Yes,The northern Brazil-Venezuela border will be closed *only humanitarian and cargo trucks are permitted to cross the border.,Not applicable,2020-03-18T00:00:00,International SOS,Other organisations,https://pandemic.internationalsos.com/2019-ncov/ncov-travel-restrictions-flight-operations-and-screening#MYS,3/25/20,
2218,Brazil,BRA,,,Americas,Introduction / extension of measures,Movement restrictions,Border closure ,Yes,"As of 19 March, all land borders with neighbouring countries of Brazil are closed. These countries include: Argentina, Bolivia, Colombia, Guyana, French Guyana, Paraguay, Peru, Suriname and Venezuela for at least 15 days. On 22 March, the land border with Uruguay was announced closed for at least 30 days. *Brazilian nationals and residents are exempt from entry restrictions, as well as humanitarian aid and cargo trucks.",Not applicable,2020-03-19T00:00:00,International SOS,Other organisations,https://pandemic.internationalsos.com/2019-ncov/ncov-travel-restrictions-flight-operations-and-screening#MYS,3/25/20,
2220,Brazil,BRA,,,Americas,Introduction / extension of measures,Public health measures,Awareness campaigns,No,"Influenza vaccination campaign. The influenza vaccine is not effective against the coronavirus, however, at this time, it will assist health professionals in excluding the diagnosis for coronavirus, since the symptoms are similar.",Not applicable,2020-03-23T00:00:00,MoH,Government,https://www.saude.gov.br/noticias/agencia-saude/46568-ministerio-da-saude-declara-transmissao-comunitaria-nacional,3/25/20,
2958,Brazil,BRA,,,Americas,Introduction / extension of measures,Movement restrictions,Border closure ,Yes,"closure of its borders, beginning on March 30, 2020 for 30 days, to individuals arriving by air who do not fall into one of the several categories. It does not prevent individuals from departing on commercial flights. However, given the decision to limit the entry of foreign nationals, the availability of international flights are declining. ",Not applicable,2020-03-30T00:00:00,US Embassy ,Government,https://br.usembassy.gov/covid-19-information/,3/29/20,
2978,Brazil,BRA,,,Americas,Introduction / extension of measures,Movement restrictions,Visa restrictions,Yes,"all foreign travelers for 30 days except residents, citizens, family members and foreign nationals crossing to get to home country, diplomats or other government officials approved entry ",Not applicable,2020-03-30T00:00:00,International SOS,Other organisations,https://pandemic.internationalsos.com/2019-ncov/ncov-travel-restrictions-flight-operations-and-screening#MYS,3/29/20,
2979,Brazil,BRA,,,Americas,Introduction / extension of measures,Movement restrictions,Border closure ,Yes,extension of land border closure with venezuela for 15 additional days *excoet cargo and humanitartian aid ,Not applicable,2020-03-27T00:00:00,International SOS,Other organisations,https://pandemic.internationalsos.com/2019-ncov/ncov-travel-restrictions-flight-operations-and-screening#MYS,3/29/20,
4448,Brazil,BRA,,,Americas,Introduction / extension of measures,Governance and socio-economic measures,Emergency administrative structures activated or established,No,"Decree 10,277 establishing a “Crisis Committee to Supervise and Monitor the Impacts of COVD-19”",Not applicable,2020-03-16T00:00:00,Global States of Emergency ,UN,https://acaps.sharepoint.com/:w:/r/sites/covid-19response/_layouts/15/Doc.aspx?sourcedoc=%7B4BD7DA89-4077-44C8-B6C3-75F03E1E90C8%7D&file=20200331%20Global-%20States%20of%20emergency.docx&action=default&mobileredirect=true,4/9/20,
4449,Brazil,BRA,,,Americas,Introduction / extension of measures,Governance and socio-economic measures,Emergency administrative structures activated or established,No,President asked Congress to declare a state of public calamity ,Not applicable,2020-03-17T00:00:00,Global States of Emergency ,UN,https://acaps.sharepoint.com/:w:/r/sites/covid-19response/_layouts/15/Doc.aspx?sourcedoc=%7B4BD7DA89-4077-44C8-B6C3-75F03E1E90C8%7D&file=20200331%20Global-%20States%20of%20emergency.docx&action=default&mobileredirect=true,4/9/20,
5457,Brazil,BRA,Bahia,,Americas,Introduction / extension of measures,Movement restrictions,Domestic travel restrictions,Yes,"In Bahia, the authorities have suspended intercity public transport across the state until 15 April",Not available,2020-04-08T00:00:00,international SOS,Other organisations,https://pandemic.internationalsos.com/2019-ncov/ncov-travel-restrictions-flight-operations-and-screening#MYS,4/15/20,
5458,Brazil,BRA,Bahia,,Americas,Introduction / extension of measures,Social distancing,Limit public gatherings,Yes,"In Bahia, the authorities have banned gatherings of more than 50 people until 19 April.",Not available,2020-04-08T00:00:00,international SOS,Other organisations,https://pandemic.internationalsos.com/2019-ncov/ncov-travel-restrictions-flight-operations-and-screening#MYS,4/15/20,
5459,Brazil,BRA,,,Americas,Introduction / extension of measures,Movement restrictions,International flights suspension,No,"extended until 30/4/2020. nonresident foreign nationals are barred from entering the country by air until April 30, except in cases where the traveler is in transit and the final destination country will permit them to enter. The restrictions do not apply to air, ground, or maritime freight transport.",Not applicable,2020-04-08T00:00:00,World Aware,Other organisations,https://www.worldaware.com/covid-19-alert-brazil-extends-travel-restrictions-until-april-30,4/15/20,
